source,link,date_time,original_text,length,geo_hint,engagement_signal,product_hint,stage,primary_breakdown_point,channel,root_cause,emotion,emotion_severity,summary_insight,actionability_score_5,fixability_score_5,evidence_strength
YouTube,https://www.youtube.com/watch?v=PMpzgLl1ksg&lc=Ugww4wsMNUQ1QHbAMiR4AaABAg,2022-04-06 05:30:00,"Awareness comment -  I am an ICICI privilege customer since 2003. Purchased ICICI Lombard health policy for the last five years without a single rupee claim. They literally put me on my knee to renew my policy - I need to struggle to renew my health policy as I don't want to lose any no-claim bonus. After reaching all the seniors in ICICI Lombard - they renewed my health policy but didn't offer my one lakh no claim bonus. 
Sorry ICICI Lombard you have cheated me - your people who pretend to help me now vanish as I already paid my two years of the health policy premium. I suggest strongly to all new customers - there are other authentic health insurance providers, pls go to them ( do a proper survey) but don't go with this "" Labad"" health service provider.",765,unknown,0,health,Servicing & Policy Admin,Policy Renewal,Agent / Advisor,Process / Documentation Friction,Betrayal,Medium,"Event: Customer sought to renew ICICI Lombard health policy after five years without claims. Process: Faced significant struggle and had to escalate to seniors for renewal to retain no-claim bonus. Outcome: Policy was renewed, but the one lakh no-claim bonus was not offered, leading to feelings of being cheated and regret.",3,2,Medium
YouTube,https://www.youtube.com/watch?v=n1wHnjnOxB4&lc=UgwQAPAiHvUPt8u6T-B4AaABAg,2025-04-05 05:30:00,"Totally disagree with you,my claim is not settled or partially approved.icici Lombard representative has assured me of the best service but no response after 15 days ,kindly don't buy any insurance policy through ICICI Lombard company.",235,unknown,2,unknown,Claims Experience,Claims Processing,Agent / Advisor,Misrepresentation / Incomplete Explanation,Anger,High,"Event: Customer sought insurance policy through ICICI Lombard. Process: ICICI Lombard representative assured best service. Outcome: Claim is not settled or partially approved, with no response after 15 days, leading the customer to warn others against buying policies through them.",3,2,Medium
YouTube,https://www.youtube.com/watch?v=n1wHnjnOxB4&lc=Ugz7QOO25ogjtkPRtpZ4AaABAg,2025-04-05 05:30:00,"My case is being processed in an unfair manner. Despite having a zero depreciation policy, I am being asked to pay 25% from my side for the claim to be approved. This is completely unreasonable and makes no sense. kbhi mat lo icici Lombard",239,unknown,0,motor,Claims Experience,Claims Processing,Unknown,Misrepresentation / Incomplete Explanation,Anger,High,"Event: Customer had a car insurance claim. Process: Despite having a zero depreciation policy with ICICI Lombard, the customer was asked to pay 25% of the claim amount for approval. Outcome: The customer finds this unreasonable and warns others not to buy ICICI Lombard policies.",3,2,Medium
YouTube,https://www.youtube.com/watch?v=pr9E4P1zobo&lc=Ugw_pckFnqPDCEBqnH14AaABAg,2025-11-04 05:30:00,"Icici sabse bekar health insurance h, mujhe high bp left hand pain and swetting ki vajya se max shalimar me admit kiya gaya 3 din admit rahi main health insurance kr sabhi rule follow kiye 2 saal se policy li hui thi 20000 wali, bil 170000 ka aaya saare documents bheje humne icici lombard ko, ek ek correct information bheji, 2 din tak baar baar documents hi maang rahe the and finally payment decline kar di inhone, ab hum cansumar cort me daalenge inka ki fraud kar rahe h ye",478,unknown,0,health,Claims Experience,Claims Processing,Claims / TPA,Process / Documentation Friction,Betrayal,High,"Event: Hospitalization for high BP, left hand pain, and sweating. Process: Followed policy rules for 2 years, submitted a bill of 170000, and sent all documents to ICICI Lombard, who repeatedly asked for documents. Outcome: Payment declined, accused of fraud, planning to go to consumer court.",3,2,Medium
YouTube,https://www.youtube.com/watch?v=QUi1ODOBu2w&lc=UgwouzFAMXo1rTRfcj14AaABAg,2024-03-31 05:30:00,"Mam ,
ICICI se Maine COVID policy Li thi aur reliance general insurance se father ki COVID positive hone ke baad dono ko report mail kar di thi 2 sal baad reliance general insurance ne Rs 25000/- credit kar diya account me lekin ICiCI Iombard IcMR report submit karne bol Raha Hain jab ki 2020 me aap se download hota tha report . Reliance ne bina ICMR report ke amount Diya par ICICI Lombard nahi de rahe hain amount main to ab kya karein ?",441,unknown,0,health,Claims Experience,Claims Processing,Claims / TPA,Process / Documentation Friction,Confusion,Medium,"Event: Purchased COVID policy from ICICI Lombard and father tested COVID positive. Process: Reported to both ICICI Lombard and Reliance General Insurance. Reliance credited Rs 25000 without ICMR report after 2 years. ICICI Lombard is now asking for an ICMR report which was downloadable in 2020. Outcome: ICICI Lombard is not providing the amount, asking for an ICMR report.",3,2,Medium
YouTube,https://www.youtube.com/watch?v=ket3NA_BMyI&lc=UgxVEI9FbY6J4mQt1oZ4AaABAg,2026-01-31 05:30:00,This ICICI Lombard is fraud company my newly less then 1month nexon claim not approve since 1week with just small accident with divider and  they just passing day by day for giving new varification officer.....,210,unknown,0,unknown,Claims Experience,Claims Processing,Claims / TPA,Process / Documentation Friction,Anger,High,"Event: A newly purchased Nexon had a small accident less than 1 month after purchase. Process: Filed a claim with ICICI Lombard, which has not been approved for 1 week, with the company repeatedly assigning new verification officers. Outcome: Claim not approved after 1 week due to ongoing verification delays.",4,3,Medium
YouTube,https://www.youtube.com/watch?v=RRpP6q4hnnE&lc=Ugyuj_VB8QYqf7_bAoV4AaABAg.9dPvSuZdeXq9dPxxkduCaz,2023-03-31 05:30:00, @Techinvented1  icici Lombard company ne mera claim reject kar diya mere dost ka licence hay mere nehi hay Maine claim Kiya lekin mere driving licence nehi hobe ki wage se claim reject ho gaya aab kya kare,206,unknown,0,unknown,Claims Experience,Claim Rejection,Unknown,Process / Documentation Friction,Confusion,Medium,ICICI Lombard company ne mera claim reject kar diya mere dost ka licence hay mere nehi hay Maine claim Kiya lekin mere driving licence nehi hobe ki wage se claim reject ho gaya aab kya kare,2,2,Medium
YouTube,https://www.youtube.com/watch?v=7LX36CEqvpQ&lc=Ugwv-ykTw4bdavzbhM94AaABAg,2026-03-08 05:30:00,"ICICI LOMBARD SE CAR INSURANCE KIYA THA 27/02/2026 PE KIYA RS 13,332 LIKI INSURANCE SUCCESS NAHI HUWA MERA Dedit Card se paisa ka refund bhi nahi aya sbse ghatiya hai icici lombard insurance company hai",202,unknown,0,car,Claims Experience,Claim Rejection,Digital / App / Website,Process / Documentation Friction,Anger,High,"ICICI LOMBARD SE CAR INSURANCE KIYA THA 27/02/2026 PE KIYA RS 13,332 LIKI INSURANCE SUCCESS NAHI HUWA MERA Dedit Card se paisa ka refund bhi nahi aya sbse ghatiya hai icici lombard insurance company hai",3,3,Medium
YouTube,https://www.youtube.com/watch?v=7LX36CEqvpQ&lc=Ugyqn1PIKb9Tv7V7IcB4AaABAg,2025-08-08 05:30:00,Icici lombard is a fraud company please don't buy or renew mat karna because they don't settle the claim at all. Don't waste your hard earned money on icici Lombard insurance they don't give insurance claim at all telling from my personal experiance,249,unknown,0,unknown,Claims Experience,Claim Rejection,Unknown,Misrepresentation / Incomplete Explanation,Betrayal,High,Icici lombard is a fraud company please don't buy or renew mat karna because they don't settle the claim at all. Don't waste your hard earned money on icici Lombard insurance they don't give insurance claim at all telling from my personal experiance,2,1,Medium
YouTube,https://www.youtube.com/watch?v=Udwf52MnKPo&lc=UgyXFpGuMHFEg_200r94AaABAg,2025-10-01 05:30:00,ICICI Lombard Ka bhi Koi bhi Insurance claim mat karvana mat lena kyunki yah bahut bada fek company hai yah 15 se 20 din Ka time lete hain aur last ke time mein jakar claim ko koi reason Bata Kar reject kar deta hai,215,unknown,0,unknown,Claims Experience,Claim Rejection,Unknown,Misrepresentation / Incomplete Explanation,Anger,High,ICICI Lombard Ka bhi Koi bhi Insurance claim mat karvana mat lena kyunki yah bahut bada fek company hai yah 15 se 20 din Ka time lete hain aur last ke time mein jakar claim ko koi reason Bata Kar reject kar deta hai,2,1,Medium
YouTube,https://www.youtube.com/watch?v=fAfNyMfNnLw&lc=Ugzf1O9KYvZFkzjaiUV4AaABAg,2024-04-05 05:30:00,Sir Mari New gandi ka insurance tah ICICI Lombard ka new gadi sirf ek month hai lealy ta to gadi ka axcdant ho gaya palhe to increase company na mana Kiya insurance Dane ke lealy bad may may cungumar court me cas dal tub 2 sal ki bad court ne nikal meri taraf se Diya usk bad insurance company na 50% payment Kiya baki 50% company nahin day raha hai isko abhi 4 sal hone wala hai vakeel ko punchta hu to 2 sal se yehi bol Raha hai ho jagaya*--* sir gadi ko leaki 30 din hi huwa tha * Aur Hum Fouj me hone ke karan jada bhag daud nahi kair pa rahe 1 month chutti multi hai to vakaal kal aana parso aana khate hai sir may kay karu batao sir please,645,unknown,0,car,Claims Experience,Partial Claim Settlement,Unknown,Process / Documentation Friction,Resignation,High,Sir Mari New gandi ka insurance tah ICICI Lombard ka new gadi sirf ek month hai lealy ta to gadi ka axcdant ho gaya palhe to increase company na mana Kiya insurance Dane ke lealy bad may may cungumar court me cas dal tub 2 sal ki bad court ne nikal meri taraf se Diya usk bad insurance company na 50% payment Kiya baki 50% company nahin day raha hai isko abhi 4 sal hone wala hai vakeel ko punchta hu to 2 sal se yehi bol Raha hai ho jagaya*--* sir gadi ko leaki 30 din hi huwa tha * Aur Hum Fouj me hone ke karan jada bhag daud nahi kair pa rahe 1 month chutti multi hai to vakaal kal aana parso aana khate hai sir may kay karu batao sir please,2,1,Medium
YouTube,https://www.youtube.com/watch?v=LhzUuKUItnA&lc=UgyJubQootQkRaB4vB54AaABAg,2025-10-01 05:30:00,Please Bhai Log Koi Bhi ICICI Lombard ki Health Insurance policy sapne mein bhi mat lena Maine Policy liyi thi Cashless claim File Kiya Tha toh Unhone 1 hi Documents Baar Baar Query lagatar Query Dali Aur Sab Answer Dene par Unhone Hospitalization Not Necessary aise bolke Claim Reject Kar diya Fraud Company hai,312,unknown,0,health,Claims Experience,Claim Rejection,Claims / TPA,Process / Documentation Friction,Betrayal,High,Please Bhai Log Koi Bhi ICICI Lombard ki Health Insurance policy sapne mein bhi mat lena Maine Policy liyi thi Cashless claim File Kiya Tha toh Unhone 1 hi Documents Baar Baar Query lagatar Query Dali Aur Sab Answer Dene par Unhone Hospitalization Not Necessary aise bolke Claim Reject Kar diya Fraud Company hai,3,2,Medium
YouTube,https://www.youtube.com/watch?v=Q98V9yeGEbA&lc=Ugwm2TuZfDSMjZd2iqN4AaABAg,2022-04-05 05:30:00,Hello sir mere big brother ki death ho gai  on the way achanak se ji ghabraya or hospital le jate wakt death ho gaya unka jivan shurksa bima icici Lombard me he kya unke parivar ko pesa milega unhone truck liya huva tha emi par kya unka truck free ho jayega 5/04/2021plz sir reply jarur dena unke 2 chhote chhote bache he,321,unknown,1,life,Claims Experience,Claim Inquiry,Unknown,Unknown,Confusion,Medium,Hello sir mere big brother ki death ho gai on the way achanak se ji ghabraya or hospital le jate wakt death ho gaya unka jivan shurksa bima icici Lombard me he kya unke parivar ko pesa milega unhone truck liya huva tha emi par kya unka truck free ho jayega 5/04/2021plz sir reply jarur dena unke 2 chhote chhote bache he,3,3,Medium
YouTube,https://www.youtube.com/watch?v=Tk4kD3ZjE2c&lc=UgyM1xczqyo-vxqfxrh4AaABAg,2020-03-31 05:30:00,"MOT09441293 for serveyvar not approving front loss, only approving back loss, wherein both side damaged at a time, serveyvar is not understanding and asking me to show video proof which how can i?, This showing how bad and unprofessional work ethics of ICICI Lombard and how they are cheating the people's, people has to stay away from ICICI Lombard this is the second time I'm facing issues with ICICI Lombard, the dealer given me without any information otherwise I will never ever had this.",493,unknown,1,unknown,Claims Experience,Claims Processing,Claims / TPA,Process / Documentation Friction,Anger,High,"Event: Vehicle damage (front and back loss). Process: Surveyor not approving front loss, asking for video proof. Outcome: Surveyor not understanding, perceived as unprofessional and cheating.",3,2,Medium
YouTube,https://www.youtube.com/watch?v=dwFnOPCV2VA&lc=UgyGrtiZXmJmvwgwV0p4AaABAg,2026-01-05 05:30:00,"I had a horrible experience with ICICI Lombard, I had a zero depreciation cover with them and my bike was affected by flood. They put all the parts under consumables (including stuff like piston rings, gears, etc) and paid only 20% of the total bill",249,unknown,5,motor,Claims Experience,Claims Settlement,Claims / TPA,Misrepresentation / Incomplete Explanation,Betrayal,High,"Event: Bike affected by flood with zero depreciation cover. Process: Insurer classified all parts, including essential engine components, under consumables. Outcome: Paid only 20% of the total bill, leading to a horrible experience.",3,2,Medium
YouTube,https://www.youtube.com/watch?v=dwFnOPCV2VA&lc=UgyL_Y_XSNV7KqlRx1Z4AaABAg,2025-09-05 05:30:00,"ICICI Lombard especially for cars is not recommendable. I had a very bad experience with ICICI Lombard, despite having very first claim in 5 years which covers end to end add-ons from zero dep to engine protect. And when it came for claim settlement, they offered a partial claim where the damage was of same incident.",318,unknown,16,motor,Claims Experience,Claims Settlement,Claims / TPA,Misrepresentation / Incomplete Explanation,Anger,High,"Event: First claim in 5 years for a car with comprehensive add-ons (zero dep, engine protect) after damage from the same incident. Process: Insurer offered a partial claim settlement. Outcome: Partial claim offered despite damage from a single incident, leading to a very bad experience.",3,2,Medium
YouTube,https://www.youtube.com/watch?v=dwFnOPCV2VA&lc=UgwfcUBw0mjSeRqw6at4AaABAg,2025-08-05 05:30:00,"sorry!!You again took the worst ma'am.
Icici lombard worst services.
was following up for claim 7 days, the engine parts were around 21k which was very less against my value and love towards my car, so i took it at home.
but icici lombard giving me msg daily morning without fail- Estimate Pending:Dear MAYANKTRIVEDI, We're constantly in touch with the garage to secure the repair estimate for your claim number ×××××.  Once we receive it, we will swiftly proceed with your claim. Thank you for your patience. Team ICICI Lombard.
😂😂😂
The lord mr surveyor said- After 7 days of follow up that- i am not able to understand how exactly this damage has happened to your vehicle.",674,unknown,0,motor,Claims Experience,Claims Processing,Claims / TPA,Process / Documentation Friction,Anger,High,"Event: Claim for engine parts (21k value). Process: Following up for 7 days, surveyor unable to understand damage after follow-up. Outcome: Surveyor stated inability to understand damage, while ICICI Lombard sent daily pending estimate messages, leading to frustration and taking the car home.",4,3,Medium
YouTube,https://www.youtube.com/watch?v=UjBCpiruozg&lc=Ugxy33mH4eFP_xXt6kR4AaABAg,2025-03-31 05:30:00,"Sir mera hospitalisation aur discharge dono ho chuka hai, but maine tpa ko inform nahi kiya, us case mein can i still proceed with claim, ke intimate karna jaroori hai, mera  bhi corporate health insurance  hai icici lombard ka",227,unknown,2,health,Claims Experience,Claims Filing,Claims / TPA,Process / Documentation Friction,Confusion,Medium,"Hospitalization and discharge completed, but TPA was not informed. Customer is asking if they can still proceed with the claim with ICICI Lombard corporate health insurance, as informing the TPA is mandatory.",3,2,Low
YouTube,https://www.youtube.com/watch?v=W1rD98xlKN8&lc=Ugxce4URfevVt1Go6NV4AaABAg,2025-03-31 05:30:00,"Maine ye plan apne parents k liye apply kiya tha phir baad me cancel kr diya.

Mujhe bola gya extra 10160 dene honge kyunki mere parents ko hypertension issue hai. Jbki maine inka Waiting period, or recommended ad-ons liya hua tha.... 
ICICI Lombard, Bewakoof bna rha.

Mt lena.... Fass jaoge",292,unknown,0,health,Early Regret / Exit Intent,Policy Purchase,Unknown,Misrepresentation / Incomplete Explanation,Betrayal,High,"Customer applied for a plan for parents, then cancelled it. Was told to pay an extra 10160 due to parents having hypertension, despite having the waiting period and recommended add-ons. Customer feels ICICI Lombard misled them and advises against buying.",4,2,Medium
YouTube,https://www.youtube.com/watch?v=eBD8oBGq7Rk&lc=UgwXD6G5_5XtlraU7ON4AaABAg.9C3PdFAeoAz9C3jOvRVoi6,2021-03-31 05:30:00, @sushmakumari8901  thanks for reply. But i have seen ICICI Lombard brochures they have sub limits in that on all surgeries. (Brochures page no 9) please clear this doubt then i ll think about taking this policy. Thankyou.,222,unknown,1,health,Onboarding & Policy Understanding,Policy Purchase,Digital / App / Website,Misrepresentation / Incomplete Explanation,Confusion,Medium,Customer has seen ICICI Lombard brochures indicating sub-limits on all surgeries (page 9) and is asking for clarification before considering policy purchase.,3,3,Medium
YouTube,https://www.youtube.com/watch?v=yilsS11fiIM&lc=UgxIFCvPJSo8adXWPRx4AaABAg,2025-04-08 05:30:00,"Icici lombard ne aaj mere sath b scam kr diya, meri bike service center me khadi h  1 week se, mere pass zero depth insurance b hai phr b mjhe claim dene se mana kr diya ye bol kar ye aapka 3rd party insurance expire ho gya h, jab already zero depth insurance hai to 3rd party insurance se matlab kya hai ,

Sirf inhe chori krna aati h , hum log ki jeb kaat rhe h, policy dete time sab under claim hota h , aur  claim lete time claim dene se mana krdenge",454,unknown,2,unknown,Claims Experience,Claims Rejection,Agent / Advisor,Process / Documentation Friction,Anger,High,"Event: Bike damage. Process: Filed a zero-depth insurance claim with ICICI Lombard. Outcome: Claim rejected stating third-party insurance expired, despite having zero-depth insurance.",3,2,Medium
YouTube,https://www.youtube.com/watch?v=yilsS11fiIM&lc=UgyJh5zO8gth0nf80i14AaABAg,2024-04-08 05:30:00,"Fraud insurance company h icici Lombard
मेरी अपाचे का शॉकर टूट गया गड्ढे में गिरने से
yhi same kahaani sunane lge
2 mahine baad claim approval diya 
Wo bhi consumer court jane ko bola hmne tb approval diya .
Wo bhi 25% payment krna pda..",237,unknown,2,unknown,Claims Experience,Claims Delay & Partial Approval,Unknown,Process / Documentation Friction,Anger,High,"Event: Bike shocker broke due to pothole. Process: Filed a claim with ICICI Lombard, faced a 2-month delay, and was told to go to consumer court. Outcome: Claim approved after 2 months with a 25% out-of-pocket payment.",3,2,Medium
YouTube,https://www.youtube.com/watch?v=yilsS11fiIM&lc=Ugy-QVm9fqtILtpCrER4AaABAg,2024-04-08 05:30:00,Bhai maine bhi icici lombard policy liya hu mera accident hua hai meri bhi bike 2 mahine se service centre me hai but policy waale natak kare hai ab mujhe bolre hai k mera normal policy hai zb policy nahi hai 50% claim hoga plzz help me bro main kya karu mera tvs rtr 200 bike hai,280,unknown,2,unknown,Claims Experience,Claims Misclassification,Unknown,Misrepresentation / Incomplete Explanation,Confusion,Medium,"Event: Bike accident. Process: Filed a claim with ICICI Lombard, which is taking 2 months to resolve. Outcome: ICICI Lombard claims it's a normal policy and only 50% claim will be paid, not a ZB policy.",3,2,Medium
YouTube,https://www.youtube.com/watch?v=OkNLO07AiiU&lc=UgxdJ4CV7U3dskbWyCt4AaABAg,2020-03-31 05:30:00,Main ne agent ko diya paysa us ne Insurance kiya pr chechis no or name bhi sahi nhi dikha raha 2 din ho gya kyse sudhrega khane pr kahta hai ab cancel nhi hoga koi sujhao de 31 august ko expare ho raha tha kya kru icici lobard ka hi hai,236,unknown,0,unknown,Onboarding & Policy Understanding,Policy Issuance Issue,Agent / Advisor,Misrepresentation / Incomplete Explanation,Confusion,Medium,"Event: Paid an agent for ICICI Lombard insurance. Process: The agent provided incorrect cheque details (cheque number and name). Outcome: The policy details are not showing correctly, and the agent says it cannot be cancelled, with the policy expiring on August 31st.",3,2,Medium
YouTube,https://www.youtube.com/watch?v=XA-JpfSBgE0&lc=UgzydK_dR_gPp5vgF1h4AaABAg,2025-04-05 05:30:00,Bhot bekar he icici lombard pichle saal renew krate time insurance le liye icici ka aur kismat kharab ki car ke samne kutta a gya icici ne sirf bumper replacmenet approval kiya aur fender bhi damage tha uska nhi diya fir 1 mahine bad ek car se accident ho gya jisme LH headlight bumper bonnet aur LH fender damage tha icici ne sirf bonnet ka replacement diya aur fender ka repair baki bumper aur headlight ka repair diya jabki fata hua bumper tha aur dono ke sare clips bhi tute the kahan se repair hoga 20k-25k apne se dena pada bhot raddi company he.,552,unknown,0,unknown,Claims Experience,Partial Claim Approval,Unknown,Process / Documentation Friction,Anger,High,"Event: Car accident involving a dog and a subsequent accident with another car. Process: Filed a claim with ICICI Lombard for bumper, fender, headlight, and bonnet damage. Outcome: ICICI Lombard only approved bumper replacement initially, then only bonnet replacement in the second accident, leaving the user to pay 20k-25k for other damages.",3,2,Medium
YouTube,https://www.youtube.com/watch?v=XA-JpfSBgE0&lc=UgwBUL4iLkt6ZcpPg8t4AaABAg,2024-04-05 05:30:00,"Sbse jyaada bekar company hai moter claim kiya tha mera privet vehical hai
Last 2 other insurance company  ne claim diya hai
But icic lombard ne mera claim 5 oct 2023 ko ye kahkar reject kar diya ki aapki car rante par chalti hai",229,unknown,0,unknown,Claims Experience,Claims Rejection,Unknown,Process / Documentation Friction,Anger,High,"Event: Motor claim filed for a private vehicle. Process: ICICI Lombard rejected the claim on October 5, 2023. Outcome: Claim rejected with the reason that the car is used for rent, despite previous claims being approved by other companies.",3,2,Medium
YouTube,https://www.youtube.com/watch?v=ve6sHV2BCM8&lc=UgwYNRd8jFKIUe6fdy94AaABAg,2025-08-31 05:30:00,"icici Health policy... Maine bhi liya hai. Lekin iss company ka service bahut hi kharab hai. Maine HDFC ergo optima secure se Icici Lombard elevate plan main port Kia tha. Ye company mara port details  update nahi kia. Main abhi 3 rd year ka premium bhi de Chuka hu, matlab 3years chal Raha hai abhi. Recently mare wife ka ek operation huwa, apply karne ke bad bhi mujhe cashless nahi mila. Maine khud bill pay Kia hospital main. Reason pucha to bola Mera port detail update nahi kia tha icici Lombard ne. Main 1000 bar customer care pH. Kia kise ke pass koyi solution nahi. Details kyu update nahi kia bata nahi sakta woh log. Ye kiski galti hai. Aap loghi batao. Abhi mujhe bol rahe hai Reimbursement ke liye apply Karo. Maine Kia. Abhi Tak koyi solution nahi. Kal ek form diya couter offer ke liye... waha likha hai Mujhe Elevate plan se health sheild product main Jana hoga. Mujhe 4000/ ka discount milega Jo main esh saal ka premium diya ush main. but reimbursement  amount milega ya nahi woh nahi likha. Form main sigh karne ke liya kaha gaya. Agar main 10 days ke andar sign nahi karunga toh likha hai Mera pura ish saal premium wapah karega aur Jo main policy liya woh terminate ho jayega. Ye froud company hai... Inka customer care service worst se worst hai. Inka kisi bhi bat ka koyi bharosa nahi hai. Main aap logo ko suggest kar Raha hu ICICI health policy kabhi mat lena.",1385,unknown,0,health,Claims Experience,Claims Experience,Unknown,Process / Documentation Friction,Anger,High,"Customer ported from HDFC Ergo to ICICI Lombard health policy. Despite being in the 3rd year and paying premiums, ICICI Lombard failed to update porting details. When the wife had an operation, cashless facility was denied, forcing the customer to pay out-of-pocket. Customer care provided no solution. Later, offered a switch to a different plan with a discount but no clarity on reimbursement, with a threat of policy termination if not signed within 10 days. Customer labels the company as fraudulent with worst customer service.",3,2,Medium
YouTube,https://www.youtube.com/watch?v=kIOnjyHhALQ&lc=Ugyje6v1uaxXcEwtJ3N4AaABAg,2024-04-05 05:30:00,"Bro i have one question, meri activa ka accident hua ek cow k sath, insurance ko 3years 1 month hue the jb mene repair centre pr submit ki apni activa, 
Policy 5 years ki h icici Lombard ki, 
Ab muje call aa rha h ki muje sirf 45% claim milega, 
Kya mai unko bol k claim% badhwa skta hu near about 60%  tk? 
Plz reply",317,unknown,2,motor,Claims Experience,Claims Experience,Unknown,Process / Documentation Friction,Confusion,Medium,"Customer's Activa had an accident with a cow, 3 years and 1 month after policy purchase (5-year ICICI Lombard policy). Repair center is stating only 45% claim will be received and customer is asking if they can negotiate to increase it to 60%.",3,3,Medium
