source,link,date_time,original_text,length,geo_hint,engagement_signal,product_hint,stage,primary_breakdown_point,channel,root_cause,emotion,emotion_severity,summary_insight,actionability_score_5,fixability_score_5,evidence_strength
YouTube,https://www.youtube.com/watch?v=kIOnjyHhALQ&lc=Ugzv_QJYM3l8uq0jFKV4AaABAg,2023-04-05 05:30:00,"Sir mera Activa 5g ka  hae std model 
Sir mera silencer Tut gya accudnet ki vajah sae plzz 
Bataiyae ki mujhe ossae repair karwnae kae liyae phlae pay karna padega parts ka cost or oska labour charge 
Ici Lombard 

Plz reply",224,unknown,0,motor,Claims Experience,Claims Experience,Unknown,Process / Documentation Friction,Confusion,Low,Customer's Activa silencer broke due to an accident and they are asking ICICI Lombard if they need to pay for the repair parts and labor charge upfront.,3,4,Low
YouTube,https://www.youtube.com/watch?v=5umE3I0Fs8I&lc=Ugzkps_A0TqxVeVcDKJ4AaABAg,2025-04-05 05:30:00,मेरा हेल्थ इंश्योरेंस है icici lombard मैं उसका प्रीमियम बहुत महंगा होगया है इसके कारण मैं पोर्ट करवाना चाहता हो और मुझे knee रिप्लेसमेंट हुआ है हर्निया का ऑपरेशन हुआ और स्टोन का भी कल मुझे क्लेम मिलेगा या नहीं कि दिक्कत करेगा ?,228,unknown,0,health,Servicing & Policy Admin,Servicing & Policy Admin,Unknown,Product Design or Complexity,Confusion,Medium,"Customer has an ICICI Lombard health insurance policy with a premium that has become very expensive. They wish to port the policy and are concerned if upcoming claims for knee replacement, hernia operation, and stone will be covered or cause issues.",2,2,Low
YouTube,https://www.youtube.com/watch?v=bmqOMpoDEh0&lc=UgwW_pV3Kp-ixhKnta54AaABAg,2026-01-31 05:30:00,"Very bad experience  at the time of discharge from Hospital 
Icici lombard 

Extremely disappointed with ICICI Lombard. Patient ready for discharge but waiting for hours due to internal claim delays. Causing unnecessary mental stress to family.
Don’t buy policy from ICICI",272,unknown,0,health,Claims Experience,Claims Experience,Unknown,Process / Documentation Friction,Anger,High,"Customer experienced significant delays at the hospital during discharge due to internal claim processing issues with ICICI Lombard, causing mental stress.",3,3,Medium
YouTube,https://www.youtube.com/watch?v=Val3TYHy2DE&lc=Ugxnh5mFzyLRDPfqghN4AaABAg,2024-04-06 05:30:00,Maam bada confusion hai .. mujhe lomabard agent ka call aaya tha.. he insisted to take advantage plan. They told health 365 have capping and not given claim. Also anytime bank can close this polich. Please guide .. i see premium is just double in case of advantage plan.,270,unknown,1,health,Onboarding & Policy Understanding,Sales Pressure or Coercion,Agent / Advisor,Misrepresentation / Incomplete Explanation,Confusion,Medium,"A Lombard agent insisted on taking an 'advantage plan', claiming the 'health 365' plan had capping and wouldn't provide claims, and that the bank could close the policy anytime. The user is confused as the premium for the advantage plan is double.",3,2,Medium
YouTube,https://www.youtube.com/watch?v=zG01BhOTvto&lc=UgyBl08R0X-6Ib1IVaN4AaABAg,2025-03-31 05:30:00,"Yaha apne jo 24 month ka waiting period bataya h ICICI LOMBARD KA wo galat bataya h ..ICOCI LOMBARD all critical treatments liks heart attack,kisi v tarah ka transplant wo sb after 30 days cover krta h ELEVATE me .😊",215,unknown,3,health,Servicing & Policy Admin,Misrepresentation / Incomplete Explanation,Unknown,Misrepresentation / Incomplete Explanation,Confusion,Low,"The user states that ICICI Lombard's 24-month waiting period for critical treatments like heart attack and transplants is incorrect, claiming the 'Elevate' plan covers them after 30 days.",3,3,Medium
YouTube,https://www.youtube.com/watch?v=UB7_Ds5iV7g&lc=UgyPFHyTLhNn1eTwXUJ4AaABAg,2025-12-31 05:30:00,ICICI Lombard mat Lena bhai accident hone k baad main ne showroom me claim k liye diya 10 din bad Jake reject Kardiya reason ye bataya k pahle se dent the accident me nahi hua Waise main 2022 se same insurance renewal karwara ho fir bhi reject kiya accident me agar kisi jaan bhi jaye ye Lok ko farak nahi padta scam hai sab,324,unknown,0,motor,Claims Experience,Claims Processing / Documentation Friction,Claims / TPA,Process / Documentation Friction,Anger,High,"After an accident, the user filed a claim with ICICI Lombard, which was rejected after 10 days with the reason that pre-existing dents were present, not caused by the accident. The user has been renewing the same insurance since 2022 and feels it's a scam.",2,1,Medium
YouTube,https://www.youtube.com/watch?v=WChUfz0lgfI&lc=UgwwD5YRxNdK5zj5IRB4AaABAg,2026-02-05 05:30:00,Sir meri phle new india se policy thi jisme ek claim aya tha ... But next year mene Lombard se policy li..but mention nahi kr paya last claim aur 20% ncb le li... Abhi wo meri pura claim reject kr rhe hain..pls help me sir ..me bahut preshan hu,244,unknown,1,motor,Claims Experience,Misrepresentation / Incomplete Explanation,Agent / Advisor,Misrepresentation / Incomplete Explanation,Confusion,High,"The user switched from New India to Lombard and did not mention a previous claim, incorrectly taking 20% NCB. Now, Lombard is rejecting their entire claim due to this. The user is seeking help as they are very distressed.",3,2,Medium
YouTube,https://www.youtube.com/watch?v=WChUfz0lgfI&lc=UgzCHQiaG3AVf0tX6YV4AaABAg,2025-04-05 05:30:00,"Sir Mene ICICI Lombard ka car insurance policy bazar se liya tha, Mera NCB 20% hona chahiye tha vo mene 50% galati se liya ab meri car ka claim wrong NCB k karan reject hua hai. Policy bazar mujhe NCB correct kr k de rahi hai but vo sure nahi hai k jo reject hua claim ICICI Lombard de degi.. ese me kya karna chahiye koi solution hai to batao sir. Car abhi bhi Garage me khadi hai koi kam nahi kiya hai abhi tak..",414,unknown,0,motor,Claims Experience,Misrepresentation / Incomplete Explanation,Digital / App / Website,Misrepresentation / Incomplete Explanation,Confusion,High,"The user mistakenly took 50% NCB from PolicyBazaar for their ICICI Lombard car insurance instead of the correct 20%. Their claim was rejected due to the wrong NCB. PolicyBazaar is correcting the NCB, but the user is unsure if ICICI Lombard will approve the rejected claim and their car is still in the garage.",3,2,Medium
YouTube,https://www.youtube.com/watch?v=WChUfz0lgfI&lc=UgwJDdjDgZgoKSpHli94AaABAg,2025-04-05 05:30:00,Bhai meri sister ke husbend expire ho gye h aor unka aadahar card me Nam nhi update hai Ar claim me galat date of birth bhari hui h. Iccci lombard bol rhi h ki tum prove kro ki unki biwi thi. To Kya kr sakte h,209,unknown,2,life,Claims Experience,Process / Documentation Friction,Claims / TPA,Process / Documentation Friction,Confusion,High,"The user's sister's husband passed away, but his Aadhaar card has an incorrect name, and the claim form has a wrong date of birth. ICICI Lombard is asking the user to prove she was his wife, and she is asking for guidance on what to do.",2,1,Medium
YouTube,https://www.youtube.com/watch?v=WChUfz0lgfI&lc=Ugy2Xsv6OJkuWomPaKN4AaABAg,2024-04-05 05:30:00,"Dear sir
I currently hold ICICI Lombard motor vehicle policy I faced NCB relative problem.  Due to some confusion I mentioned 35% NCB in insurance apply form but company said according to last policy it should be 25%. 
Due to this reason insurance company denied to provide me claim and insurance company not given me any written notice about rejection of my insurance.
what can I do please reply🙏",397,unknown,1,motor,Claims Experience,Misrepresentation / Incomplete Explanation,Unknown,Misrepresentation / Incomplete Explanation,Confusion,Medium,"The user holds an ICICI Lombard motor policy and incorrectly mentioned 35% NCB in the application, while the company states it should be 25% based on the last policy. Due to this, the insurance company denied the claim without providing a written rejection notice. The user is asking for advice on what to do.",3,2,Medium
YouTube,https://www.youtube.com/watch?v=WChUfz0lgfI&lc=Ugz_Uo92EwGChKhH0EV4AaABAg,2024-04-05 05:30:00,Bhai mene apni car claim ki thi icici lombard me … documents me maine apna DL dia tha lekin glti ye huii ki jb verification call aayi to maine glti se bol dia bhai gaadi chala rha tha … ab kya kruuuu .. ab wo bol rhe ki reject ho jaayegii,238,unknown,1,car,Claims Experience,Claims Processing,Unknown,Process / Documentation Friction,Confusion,Medium,"Event: Car accident. Process: Filed a claim with ICICI Lombard, provided DL as document, admitted to driving during verification call. Outcome: Claim expected to be rejected due to admission.",2,1,Low
YouTube,https://www.youtube.com/watch?v=xCkCGGsZgWs&lc=Ugw6tNwISoxJaooSpr54AaABAg,2025-10-31 05:30:00,"Mere sath icici Lombard company ne isse bhi badha fraud Kiya h . 
Ye company bas premium lene k liye h . Kyunki jab loss Hota h tab ye hath khadhe Kar lete h . Or rozz nayi kahani banaker consumer ko itna pareshaan Kar lete h . Ki wohh haar jaye formalities Puri karte karte",274,unknown,2,unknown,Claims Experience,Claim Denial,Unknown,Process / Documentation Friction,Betrayal,High,"Event: Customer experienced a loss. Process: Filed a claim with ICICI Lombard, but the company allegedly makes excuses and causes distress during the claims process. Outcome: Claim was not settled, customer feels harassed and defeated.",2,1,Medium
YouTube,https://www.youtube.com/watch?v=t6sX7bSBbO0&lc=UgyrOZ7WH1SFbX8yIcF4AaABAg,2024-03-31 05:30:00,"This is not a regular post that i generally stick to but its important and I think as a law abiding citizen its my responsibility to make people aware about such incidents

ICICI Lombard has been a disaster when it comes to professionalism and ethics.

I hope this message finds everyone well. I am writing to express my deep dissatisfaction and frustration with the recent experience I had while trying to file a claim for a minor accident with ICICI Lombard that occurred on September 8th.

On the said date, I and my wife encountered an unfortunate accident near Patny Circle, Secunderabad which was primarily caused by a reckless auto driver. As a result, my vehicle suffered a damaged bumper and a scratch on the left side. In a stressful situation, I managed to handle the aggressiveness of some individuals involved, despite their mistake in the incident.

Given that I had diligently purchased a comprehensive insurance policy that was supposed to cover such unforeseen events, I promptly reached out to the company to initiate the claim process. However, the ordeal that followed has been extremely disappointing and disheartening.

The insurance claim Guvulla Ravindra agent I spoke with exhibited a complete lack of professionalism and empathy. Instead of understanding the situation and assisting me with the claim process, he used derogatory language and accused me of cheating and fraud, as if the insurance company held a monopoly on moral high ground and transparency. This behaviour is entirely unacceptable and unbecoming of a so called reputable insurance company.

Furthermore, the agent seemed to have no knowledge of the details regarding the damages to my vehicle. He immediately produced a vehicle challan, attempting to use it as a pretext to deny my claim. This approach has left me feeling unfairly treated and deceived as a customer who faithfully invested in your insurance services for protection during such adversities.

I wish to share this disheartening experience with all my friends, family, and acquaintances, to raise awareness about the unacceptable treatment I have endured. I urge anyone considering insurance services to exercise caution when dealing with ICICI Lombard company, as the claim settlement ratio alone should not be the sole factor in choosing an insurance provider.

I would also like to highlight that the frequency and persistence of phone calls that we get from their representatives, attempting to pressure and harass us into settling for less than I am rightfully entitled to under my insurance policy, have become completely unbearable

During times of distress and vulnerability, customers expect compassion, understanding, and a seamless claim process from their insurance company. Unfortunately, my experience has been quite the opposite. I sincerely hope that ICICI Lombard company should be actually dealt and I will take this matter as far possible to sort this out.",2934,"Secunderabad, India",0,car,Claims Experience,Claim Denial,Agent / Advisor,Misrepresentation / Incomplete Explanation,Anger,High,"Event: Minor accident on September 8th. Process: Filed a claim with ICICI Lombard, agent Guvulla Ravindra used derogatory language, accused of cheating, produced a challan to deny claim, and pressured for settlement. Outcome: Claim is being unfairly treated and potentially denied.",2,1,Medium
YouTube,https://www.youtube.com/watch?v=HVYY0HwV7IA&lc=UgyZEokfFj6PwvT_bd54AaABAg,2024-03-31 05:30:00,meri ola s1 ka accident huwa tha accident ke baad maine ola mein intimate kiya aur uske baad surgery thi meri mujhe pata nahi tha time limit ke baare mein within a month mujhe pata chala icici lombard mein contact karna padega mujhe ola walo ne mujhe bataya hi nahi fir icici lombard mein claim raise kiya waha se surveyor ne inspection kiya claim approved bhi ho gaya lekin gaadi band jaane ke baad surveyor bola 75% hi milega maine bola usko kyu zero dept mein 100% milta hai fir usne ka maine late intimate kiya icici lombard ko uska proper proof do kyu late huwa mein 100 % claim de duga maine doctor ka certificate dikhaya usko fir usne kaha ab mere paas proof hai surgery ke baad intimate kar sakte ho abhi kuch nahi milega 0 % pura 6000 rs maine apne bank account se pay kiya fir maine 75% bhi nahi diya fir again gaadi band jaane ke baad meri gaadi parking mein thi toh koi touch karke gira ke gaya body mein dents aa gaye right aur left side maine turant intimate kiya aur 9 hazar ka bill aaya abhi approval sirf left side mein diya hai jaha kam damage hai right side damage ka approval nahi de rahe keh rahe hai parking mein gira toh ek side hi gira hoga maine kaha kisi ne pehle left side se thoka hoga tabhi right side gaadi giri hai na bole nahi sirf one side milega dusre side ka claim nahi milega tanashahi hai abhi kuch bolo toh bol dega yeh bhi milega jaa ke case karo consumer court mein pehle bhi aisa bol chuka hai aur koi sunne wala bhi nahi customer care wale bolte hai claim paas hoga ya nahi surveyor decide karega aur surveyor koi na koi loop hole nikal ke bekaar ke bahane batake claim reject hi kar deta hai hamesha,1642,unknown,0,car,Claims Experience,Claim Denial,Claims / TPA,Process / Documentation Friction,Anger,High,"Event: Ola S1 scooter accident. Process: Intimated Ola, then had surgery, later learned about ICICI Lombard claim time limit. Claim approved initially, but surveyor offered only 75% due to late intimation, then denied 100% even after proof of surgery. Later, new dents occurred in parking, claim for one side denied citing it fell on one side. Outcome: Claim denied for multiple damages, customer feels treated with 'dictatorship' and told to go to consumer court.",2,1,Medium
YouTube,https://www.youtube.com/watch?v=zz_AWS0ntK8&lc=UgzGnh5qAJHwOS_s-ch4AaABAg,2025-04-05 05:30:00,Aaj hi ICICI Lombard ka cashless claim me admit hua hun. Pre Authorization me 50% hi approval aya hei agr kl discharge ke time srf 70-80% hi approved hua toh kya final approval form me jo baki amount approve nhi hua hoga uska reason likha hoga ya nhi. Hospital ne 12K ke test kiye hein admit krne se pehle kya woh cashless claim me daal skta hun ya pre hospitalization me daalne pdege. Mene private lab se bi test krwaya tha parso alg clinic ke doctor ko dikha kr toh kya woh bi pre hospitalization me daal skta hun. Please sbi ki clarification dena.,550,unknown,3,health,Claims Experience,Claims Experience,Claims / TPA,Process / Documentation Friction,Confusion,Medium,Aaj hi ICICI Lombard ka cashless claim me admit hua hun. Pre Authorization me 50% hi approval aya hei agr kl discharge ke time srf 70-80% hi approved hua toh kya final approval form me jo baki amount approve nhi hua hoga uska reason likha hoga ya nhi. Hospital ne 12K ke test kiye hein admit krne se pehle kya woh cashless claim me daal skta hun ya pre hospitalization me daalne pdege. Mene private lab se bi test krwaya tha parso alg clinic ke doctor ko dikha kr toh kya woh bi pre hospitalization me daal skta hun. Please sbi ki clarification dena.,3,3,Medium
YouTube,https://www.youtube.com/watch?v=THThOmzcpMI&lc=Ugy6ef6-BiEQvvFclAl4AaABAg.AFu9wY4xW2jAG8CkOe6b2P,2025-04-05 05:30:00,"Is ak karan ke liya koi bhi SAHI(Stand Alone Health Insurance) company se Health insurance nahi lena chahiya(Care, niva, star, manipal).General Insurance campany se hi Health insurance lena chahiya right now. Mane apna insurance ICICI Lombard me kiya hai, 4 bar claim le chuka hu ajtak akbhi claim nahi ruka and the best thing is that everywhere cashless hai......claim settlement Ratio 99.97% hai much batter than SAHI company",427,unknown,1,health,Claims Experience,Claims Experience,Unknown,Unknown,Unknown,Low,"Is ak karan ke liya koi bhi SAHI(Stand Alone Health Insurance) company se Health insurance nahi lena chahiya(Care, niva, star, manipal).General Insurance campany se hi Health insurance lena chahiya right now. Mane apna insurance ICICI Lombard me kiya hai, 4 bar claim le chuka hu ajtak akbhi claim nahi ruka and the best thing is that everywhere cashless hai......claim settlement Ratio 99.97% hai much batter than SAHI company",1,1,Medium
YouTube,https://www.youtube.com/watch?v=THThOmzcpMI&lc=UgxLkqPGuH_ZK10LC1R4AaABAg,2025-04-05 05:30:00,"Bro 3 baar port kiya hoon claim related issues ke liye aur finally ICICI Lombard mein hoon. Mehenga hai lekin 2 baar claim kiya aur koi takleef nahi hui, infact mera 2nd claim toh tie-up hospital mein bhi nahi tha phir bhi cashless kar diya unhone.",248,unknown,3,health,Claims Experience,Claims Experience,Unknown,Unknown,Unknown,Low,"Bro 3 baar port kiya hoon claim related issues ke liye aur finally ICICI Lombard mein hoon. Mehenga hai lekin 2 baar claim kiya aur koi takleef nahi hui, infact mera 2nd claim toh tie-up hospital mein bhi nahi tha phir bhi cashless kar diya unhone.",2,2,Medium
YouTube,https://www.youtube.com/watch?v=THThOmzcpMI&lc=Ugzdazgo9PGjjAtc0-p4AaABAg,2025-04-05 05:30:00,I was also admitted in other hospital which was not listed in cashless facility but I got all the documents and I uploaded in ICICI Lombard app within 15-17 days I got my claim passed. Overall mera experience sahi raha,218,unknown,0,health,Claims Experience,Claims Experience,Digital / App / Website,Unknown,Unknown,Low,I was also admitted in other hospital which was not listed in cashless facility but I got all the documents and I uploaded in ICICI Lombard app within 15-17 days I got my claim passed. Overall mera experience sahi raha,3,3,Medium
YouTube,https://www.youtube.com/watch?v=THThOmzcpMI&lc=UgxEJY3GXDI89cUPmqp4AaABAg,2025-04-05 05:30:00,Mere pass icici lombard ka insurance tha or meri Kidney damage ho gai but tab meh Dubai meh job krta tha or mujhe udher apni first dyalsis krvai or jab meh after two week resign or visa cancel krva kr aya tab insurance meh mere dyalsis or kidney treatment isley cancel kiya ki meri first dyalsis and test india se krvana chaiye tha,331,unknown,0,health,Claims Experience,Claims Experience,Unknown,Misrepresentation / Incomplete Explanation,Betrayal,High,Mere pass icici lombard ka insurance tha or meri Kidney damage ho gai but tab meh Dubai meh job krta tha or mujhe udher apni first dyalsis krvai or jab meh after two week resign or visa cancel krva kr aya tab insurance meh mere dyalsis or kidney treatment isley cancel kiya ki meri first dyalsis and test india se krvana chaiye tha,1,1,Medium
YouTube,https://www.youtube.com/watch?v=THThOmzcpMI&lc=UgxaMigPGS5Y83Bpnyl4AaABAg,2025-04-05 05:30:00,"I have mediclaim through my company which is ICICI Lombard.. recently I got diagnosed with kidney stone operation and hospital was on list of mediclaim so it got approved easily in cashless process..I was too afraid what if doctor will do unnecessary operation to get mediclaim money...gharwale bhi dant rahe the kyoki decision operation ka gharwalo se discuss nahi kiya tha...
Private hospitals or doctor par trust karna bahot hard hai aaj kal.",445,unknown,0,health,Claims Experience,Claims Experience,Unknown,Unknown,Confusion,Medium,I have mediclaim through my company which is ICICI Lombard.. recently I got diagnosed with kidney stone operation and hospital was on list of mediclaim so it got approved easily in cashless process..I was too afraid what if doctor will do unnecessary operation to get mediclaim money...gharwale bhi dant rahe the kyoki decision operation ka gharwalo se discuss nahi kiya tha. Private hospitals or doctor par trust karna bahot hard hai aaj kal.,3,3,Medium
YouTube,https://www.youtube.com/watch?v=jL3QnEiMsx0&lc=Ugz4wZiHlw5QUSIW26R4AaABAg,2023-03-31 05:30:00,Mere papa ka policy tha icici me mere papa ki death ho gayi 1 year ho gaya he or hamne claim kiya thaa icici lombard me but abhi take kuh hua nahi sab formalities bhi completed kar di he fir bhi or claim reject nahi hua fir kyu nahi pass huyi policy?  Policy agent bhi kuch anwer nahi de rahe he,295,unknown,1,unknown,Claims Experience,Claims Processing,Agent / Advisor,Process / Documentation Friction,Resignation,High,"My father had a policy with ICICI Lombard, and he passed away a year ago. We filed a claim with ICICI Lombard, but nothing has happened yet. All formalities are completed, yet the claim was not rejected, but it also hasn't been passed. The policy agent is also not providing any answers.",3,2,Medium
YouTube,https://www.youtube.com/watch?v=wLdmuXxwRys&lc=Ugwg-rnQygGdbUpPf-J4AaABAg.9rV_jxlVTiQA-EvSlLJixK,2024-04-05 05:30:00,"Same here, i had taken 2A plan policy icici lombard in 2023, rs 8659/. Annual premium, and now after year for renewal amount showing aprx 38000/. Multiple of 4times, it's too much fraud there customers, it's should case registered on company as they are selling fake commitments that they will not change 5 yrs premium.",319,unknown,0,unknown,Onboarding & Policy Understanding,Premium Increase,Unknown,Misrepresentation / Incomplete Explanation,Anger,High,"I purchased a 2A plan policy from ICICI Lombard in 2023 for Rs 8659 annually. Now, for renewal, the amount is showing approximately Rs 38000, a four-fold increase. This is fraud; customers are being deceived. The company made fake commitments that the premium would not change for 5 years.",4,3,Medium
YouTube,https://www.youtube.com/watch?v=wLdmuXxwRys&lc=UgyxXXxHuhAxPix_7XB4AaABAg.9rIkeH5gZh09sA0ZJzTsfX,2024-04-05 05:30:00,"​ @Bankingjankariamit , sir I am icici customer and  customer  care confirmed, it's a group policy...tie up with icici Lombard on mutual understanding...1 year policy tenure ...no promish of continuity for life long....",219,unknown,0,unknown,Onboarding & Policy Understanding,Policy Type Confirmation,Unknown,Misrepresentation / Incomplete Explanation,Confusion,Medium,"I am an ICICI customer, and customer care confirmed that it is a group policy, a tie-up with ICICI Lombard based on mutual understanding with a 1-year policy tenure. There was no promise of lifelong continuity.",2,2,Medium
YouTube,https://www.youtube.com/watch?v=zdfdK9uPAs4&lc=UgznP2Q6bfU4pK6iXMV4AaABAg,2025-04-05 05:30:00,Sir mera accident 8 jan ko hua tha but muje emergency se jo prescription mila us pe mlc number mention hai but original MLC nahi mili hai.kya mai prescription ki copy jispe mlc number likha hai wo copy laga ke insurance reimbursement claim kar sakta hun ya insurance company ko mlc copy dena mandatory hai. Mere pass icici Lombard ki corporate policy hai,354,unknown,3,unknown,Claims Experience,Claim Reimbursement,Claims / TPA,Process / Documentation Friction,Confusion,Medium,"My accident occurred on January 8th. The emergency prescription has an MLC number, but I don't have the original MLC. Can I claim reimbursement using a copy of the prescription with the MLC number, or is the MLC copy mandatory for the insurance company? I have a corporate policy with ICICI Lombard.",3,3,Medium
